{
  "schema_version": "1.0",
  "template_id": "qwen_image",
  "name": "Qwen Image Natural Language",
  "supported_lengths": [
    "compact",
    "standard",
    "detailed"
  ],
  "separator": " ",
  "positive_templates": {
    "compact": "[[if prefix]]{prefix}. [[endif]][[if visual_style]]Generate {visual_style}.[[endif]][[if character]] Show {character}[[endif]][[if hair_color]], with {hair_color} hair[[endif]][[if hair_style]] {hair_style}[[endif]][[if face_paint]], {face_paint}[[endif]][[if figure]], {figure}[[endif]][[if body_art]], {body_art}[[endif]][[if fashion]], wearing {fashion}[[endif]][[if eyewear]], {eyewear}[[endif]][[if headwear]], {headwear}[[endif]][[if bag]], {bag}[[endif]][[if handheld]], carrying {handheld}[[endif]]. [[if action]]She is {action}[[endif]][[if location]] {location}[[endif]].[[if atmosphere]] {atmosphere}.[[endif]] [[if framing]] Use {framing}[[endif]][[if lighting]] and {lighting}[[endif]]. [[if required_terms]] Include {required_terms}.[[endif]][[if suffix]] {suffix}.[[endif]]",
    "standard": "[[if prefix]]{prefix}. [[endif]][[if visual_style]]Generate {visual_style}.[[endif]][[if character]] The subject is {character}.[[endif]][[if body]] She is {body}.[[endif]][[if skin]] She has {skin}.[[endif]][[if eyes]] She has {eyes}.[[endif]][[if face_shape]] Give her {face_shape}.[[endif]][[if features]] Give her {features}.[[endif]][[if brows]] Give her {brows}.[[endif]][[if lips]] Give her {lips}.[[endif]][[if hair_color]] Her hair is {hair_color}[[endif]][[if hair_style]], worn {hair_style}[[endif]][[if face_paint]], {face_paint}[[endif]][[if figure]], {figure}[[endif]][[if body_art]], {body_art}[[endif]]. [[if fashion]] Dress her in {fashion}[[endif]][[if footwear]], with {footwear}[[endif]][[if outerwear]], and {outerwear}[[endif]][[if accessory]], and {accessory}[[endif]][[if eyewear]], {eyewear}[[endif]][[if headwear]], {headwear}[[endif]][[if bag]], {bag}[[endif]][[if handheld]], carrying {handheld}[[endif]]. [[if action]] She is {action}[[endif]][[if location]] {location}[[endif]].[[if environment]] The setting is {environment}.[[endif]][[if atmosphere]] {atmosphere}.[[endif]] [[if pose]] Pose her {pose}.[[endif]][[if head_position]] Her head is {head_position}.[[endif]][[if gaze]] She is {gaze}.[[endif]][[if expression]] Give her {expression}.[[endif]][[if props]] Include {props|join:\" and \"} in the frame.[[endif]][[if framing]] Frame the shot as {framing}[[endif]][[if camera_angle]] from {camera_angle}[[endif]]. [[if lighting]] Light the scene with {lighting}.[[endif]][[if finish]] Render with {finish}.[[endif]][[if required_terms]] Include {required_terms}.[[endif]][[if suffix]] {suffix}.[[endif]]",
    "detailed": "[[if prefix]]{prefix}. [[endif]][[if visual_style]]Generate {visual_style}.[[endif]][[if character]] The subject is {character}.[[endif]][[if body]] She is {body}.[[endif]][[if skin]] She has {skin}.[[endif]][[if eyes]] She has {eyes}.[[endif]][[if face_shape]] Give her {face_shape}.[[endif]][[if features]] Give her {features}.[[endif]][[if brows]] Give her {brows}.[[endif]][[if lips]] Give her {lips}.[[endif]][[if hair_color]] Her hair is {hair_color}[[endif]][[if hair_style]], worn {hair_style}[[endif]][[if face_paint]], {face_paint}[[endif]][[if figure]], {figure}[[endif]][[if body_art]], {body_art}[[endif]]. [[if fashion]] Dress her in {fashion}[[endif]][[if footwear]], with {footwear}[[endif]][[if outerwear]], and {outerwear}[[endif]][[if accessory]], and {accessory}[[endif]][[if eyewear]], {eyewear}[[endif]][[if headwear]], {headwear}[[endif]][[if bag]], {bag}[[endif]][[if handheld]], carrying {handheld}[[endif]]. [[if action]] She is {action}[[endif]][[if location]] {location}[[endif]]. [[if environment]] The setting is {environment}.[[endif]][[if atmosphere]] {atmosphere}.[[endif]][[if time]] Set the scene in the {time}.[[endif]][[if season]] The season is {season}.[[endif]][[if weather]] Show {weather} outside.[[endif]][[if props]] Include {props|join:\" and \"} in the frame.[[endif]][[if pose]] Pose her {pose}.[[endif]][[if head_position]] Her head is {head_position}.[[endif]][[if expression]] Give her {expression}[[endif]][[if gaze]], {gaze}[[endif]]. [[if framing]] Frame the shot as {framing}[[endif]][[if camera_angle]] from {camera_angle}[[endif]][[if camera_behavior]], with {camera_behavior}[[endif]]. [[if lighting]] Light the scene with {lighting}.[[endif]][[if finish]] Render the image with {finish}[[endif]][[if color_treatment]] and {color_treatment}[[endif]]. [[if required_terms]] Include {required_terms}.[[endif]][[if suffix]] {suffix}.[[endif]]"
  },
  "negative_template": "{entry_negative_prompts}, {user_negative_prompt}",
  "omit_empty_sections": true,
  "sentence_case": true
}
