{
  "schema_version": "1.0",
  "template_id": "flux_klein",
  "name": "Flux Klein Descriptive Fragments",
  "supported_lengths": [
    "compact",
    "standard",
    "detailed"
  ],
  "separator": ", ",
  "positive_templates": {
    "compact": "[[if prefix]]{prefix}[[endif]][[if visual_style]], {visual_style}[[endif]][[if character]], {character}[[endif]][[if hair_color]], {hair_color}[[endif]][[if hair_style]], {hair_style}[[endif]][[if face_paint]], {face_paint}[[endif]][[if figure]], {figure}[[endif]][[if body_art]], {body_art}[[endif]][[if fashion]], {fashion}[[endif]][[if footwear]], {footwear}[[endif]][[if outerwear]], {outerwear}[[endif]][[if accessory]], {accessory}[[endif]][[if eyewear]], {eyewear}[[endif]][[if headwear]], {headwear}[[endif]][[if bag]], {bag}[[endif]][[if handheld]], {handheld}[[endif]][[if action]], {action}[[endif]][[if location]], {location}[[endif]][[if atmosphere]], {atmosphere}[[endif]][[if framing]], {framing}[[endif]][[if lighting]], {lighting}[[endif]][[if required_terms]], {required_terms}[[endif]][[if suffix]], {suffix}[[endif]]",
    "standard": "[[if prefix]]{prefix}[[endif]][[if visual_style]], {visual_style}[[endif]][[if character]], {character}[[endif]][[if body]], {body}[[endif]][[if figure]], {figure}[[endif]][[if skin]], {skin}[[endif]][[if eyes]], {eyes}[[endif]][[if face_shape]], {face_shape}[[endif]][[if features]], {features}[[endif]][[if brows]], {brows}[[endif]][[if lips]], {lips}[[endif]][[if hair_color]], {hair_color}[[endif]][[if hair_style]], {hair_style}[[endif]][[if face_paint]], {face_paint}[[endif]][[if fashion]], {fashion}[[endif]][[if footwear]], {footwear}[[endif]][[if outerwear]], {outerwear}[[endif]][[if accessory]], {accessory}[[endif]][[if eyewear]], {eyewear}[[endif]][[if headwear]], {headwear}[[endif]][[if bag]], {bag}[[endif]][[if handheld]], {handheld}[[endif]][[if action]], {action}[[endif]][[if location]], {location}[[endif]][[if environment]], {environment}[[endif]][[if atmosphere]], {atmosphere}[[endif]][[if pose]], {pose}[[endif]][[if head_position]], {head_position}[[endif]][[if gaze]], {gaze}[[endif]][[if expression]], {expression}[[endif]][[if props]], {props|join:\", \"}[[endif]][[if framing]], {framing}[[endif]][[if camera_angle]], {camera_angle}[[endif]][[if lighting]], {lighting}[[endif]][[if finish]], {finish}[[endif]][[if required_terms]], {required_terms}[[endif]][[if suffix]], {suffix}[[endif]]",
    "detailed": "[[if prefix]]{prefix}[[endif]][[if visual_style]], {visual_style}[[endif]][[if character]], {character}[[endif]][[if body]], {body}[[endif]][[if figure]], {figure}[[endif]][[if skin]], {skin}[[endif]][[if eyes]], {eyes}[[endif]][[if face_shape]], {face_shape}[[endif]][[if features]], {features}[[endif]][[if brows]], {brows}[[endif]][[if lips]], {lips}[[endif]][[if hair_color]], {hair_color}[[endif]][[if hair_style]], {hair_style}[[endif]][[if face_paint]], {face_paint}[[endif]][[if fashion]], {fashion}[[endif]][[if footwear]], {footwear}[[endif]][[if outerwear]], {outerwear}[[endif]][[if accessory]], {accessory}[[endif]][[if eyewear]], {eyewear}[[endif]][[if headwear]], {headwear}[[endif]][[if bag]], {bag}[[endif]][[if handheld]], {handheld}[[endif]][[if action]], {action}[[endif]][[if location]], {location}[[endif]][[if environment]], {environment}[[endif]][[if atmosphere]], {atmosphere}[[endif]][[if time]], {time}[[endif]][[if season]], {season}[[endif]][[if weather]], {weather}[[endif]][[if props]], {props|join:\", \"}[[endif]][[if pose]], {pose}[[endif]][[if head_position]], {head_position}[[endif]][[if expression]], {expression}[[endif]][[if gaze]], {gaze}[[endif]][[if framing]], {framing}[[endif]][[if camera_angle]], {camera_angle}[[endif]][[if camera_behavior]], {camera_behavior}[[endif]][[if lighting]], {lighting}[[endif]][[if finish]], {finish}[[endif]][[if color_treatment]], {color_treatment}[[endif]][[if required_terms]], {required_terms}[[endif]][[if suffix]], {suffix}[[endif]]"
  },
  "negative_template": "{entry_negative_prompts}, {user_negative_prompt}",
  "omit_empty_sections": true,
  "sentence_case": false
}
